{
  "$schema": "http://json-schema.org/schema#",
  "additionalProperties": false,
  "properties": {
    "clients": {
      "items": {
        "type": "string"
      },
      "maxItems": 10,
      "minItems": 0,
      "type": "array"
    },
    "companiesHouseNumber": {
      "oneOf": [
        {
          "maxLength": 8,
          "minLength": 8,
          "type": "string"
        },
        {
          "type": "null"
        }
      ]
    },
    "contactInformation": {
      "items": {
        "$ref": "file:json_schemas/contact-information.json"
      },
      "minItems": 1,
      "type": "array"
    },
    "description": {
      "type": "string"
    },
    "dunsNumber": {
      "pattern": "^[0-9]+$",
      "type": "string"
    },
    "eSourcingId": {
      "pattern": "^[0-9]+$",
      "type": "string"
    },
    "id": {
      "type": "integer"
    },
    "name": {
      "type": "string"
    },
    "organisationSize": {
      "type": "string"
    },
    "otherCompanyRegistrationNumber": {
      "type": "string"
    },
    "registeredName": {
      "type": "string"
    },
    "registrationCountry": {
      "type": "string"
    },
    "registrationDate": {
      "type": "string"
    },
    "tradingStatus": {
      "type": "string"
    },
    "vatNumber": {
      "type": "string"
    }
  },
  "required": [
    "id",
    "name"
  ],
  "title": "Schema to validate updates to supplier data",
  "type": "object"
}
