{
  "id": 123456,
  "name": "Example Company Limited",
  "description": "Example Company Limited is an innovation station sensation; we deliver software so bleeding edge you literally won't be able to run any of it on your systems.",
  "contactInformation": [
    {
      "website": "www.examplecompany.biz",
      "contactName": "John Example",
      "email": "j@examplecompany.biz",
      "phoneNumber": "07309404738",
      "address1": "123 Fake Street",
      "city": "London",
      "country": "United Kingdom",
      "postcode": "F4 K1E"
    },
    {
      "id": 1,
      "website": "http://www.don.com?fref=ts",
      "contactName": "Don",
      "email": "don@don.com",
      "phoneNumber": "020 7918 9200",
      "address1": "4 Don Hill",
      "address2": "Flat 1",
      "city": "London",
      "country": "UK",
      "postcode": "EC1A D0N"
    }
  ],
  "dunsNumber": "333333333",
  "eSourcingId": "333333",
  "clients":
  [
    "UK Ministry of Defence",
    "Astula Ltd",
    "Bedrock Communications Ltd"
  ]
}
